{
  "number": 32,
  "title": "As Visões Proféticas de Daniel",
  "book": "daniel",
  "visualType": "danielTimeline",
  "visualData": {
    "heading": "Os Quatro Impérios de Daniel | Mapa Temporal",
    "title": "AS QUATRO BESTAS · DANIEL 7 · OS QUATRO IMPÉRIOS",
    "empires": [
      {
        "id": "babylon",
        "name": "BABILÔNIA",
        "creature": "Leão com asas",
        "reference": "Daniel 7:4",
        "period": "605–539 a.C.",
        "figure": "Nabucodonosor",
        "x": 130,
        "position": "top",
        "color": "#c9a84c",
        "nameColor": "#c9a84c"
      },
      {
        "id": "persia",
        "name": "MEDO-PÉRSIA",
        "creature": "Urso com costelas",
        "reference": "Daniel 7:5 / 8:20",
        "period": "539–331 a.C.",
        "figure": "Ciro / Dario",
        "x": 290,
        "position": "bottom",
        "color": "#8a9a7a",
        "nameColor": "#8a9a7a"
      },
      {
        "id": "greece",
        "name": "GRÉCIA",
        "creature": "Leopardo com asas",
        "reference": "Daniel 7:6 / 8:21",
        "period": "331–146 a.C.",
        "figure": "Alexandre",
        "x": 470,
        "position": "top",
        "color": "#7a9aaf",
        "nameColor": "#7a9aaf"
      },
      {
        "id": "rome",
        "name": "ROMA",
        "creature": "Besta terrível",
        "reference": "Daniel 7:7",
        "period": "146 a.C.→ futuro",
        "figure": "10 chifres / Anticristo",
        "x": 640,
        "position": "bottom",
        "color": "#8b3020",
        "nameColor": "#c44040"
      }
    ],
    "terminal": {
      "lines": ["Filho do", "Homem"],
      "reference": "Dan 7:13"
    },
    "note": "As mesmas quatro potências aparecem em Daniel 2 como partes de uma estátua (ouro, prata, bronze, ferro)"
  },
  "days": [
    {
      "dayOfWeek": "Domingo",
      "reading": "Daniel 7",
      "context": "A visão das quatro bestas e o Ancião de Dias — um dos textos proféticos mais densos de todo o AT."
    },
    {
      "dayOfWeek": "Segunda-feira",
      "reading": "Daniel 8",
      "context": "O carneiro e o bode — Pérsia e Grécia prefigurados. Gabriel explica a visão a Daniel."
    },
    {
      "dayOfWeek": "Terça-feira",
      "reading": "Daniel 9:1–19",
      "verses": "v.1–19",
      "context": "A oração de confissão de Daniel — um dos momentos de intercessão mais profundos da Bíblia."
    },
    {
      "dayOfWeek": "Quarta-feira",
      "reading": "Daniel 9:20–27",
      "verses": "v.20–27",
      "context": "As Setenta Semanas — profecia central da escatologia bíblica. Leitura lenta e cuidadosa."
    },
    {
      "dayOfWeek": "Quinta-feira",
      "reading": "Daniel 10 – 11",
      "context": "O anjo mensageiro e a guerra espiritual. Daniel 11 traça o curso de impérios com precisão histórica notável."
    },
    {
      "dayOfWeek": "Sexta-feira",
      "reading": "Daniel 12",
      "context": "O fim dos tempos, a ressurreição e a instrução final a Daniel. Encerramento majestoso do livro."
    }
  ],
  "complement": {
    "intro": "Esta semana mergulhamos no coração profético do Antigo Testamento. Daniel 7–12 é a fundação sobre a qual toda a escatologia bíblica é construída — Jesus cita Daniel diretamente no Sermão do Oliveiras, e o Apocalipse ecoa suas imagens em dezenas de passagens. Reserve a hora completa: o material desta semana é excepcionalmente rico.",
    "resources": [
      {
        "type": "thompson",
        "title": "Bíblia Thompson",
        "items": [
          "Cadeia temática nº 3562 — 'Filho do Homem': rastreie todas as ocorrências desde Daniel 7 até os Evangelhos e Apocalipse",
          "Cadeia temática nº 3940 — 'Ressurreição dos mortos': Daniel 12:2 é o marco do AT; compare com 1Ts 4 e Ap 20",
          "Nota de estudo em Daniel 9:24–27: as Setenta Semanas — Thompson traz cronologia detalhada",
          "Índice de Tópicos: 'Profecia messiânica' — veja como Daniel é listado como cumprimento"
        ]
      },
      {
        "type": "scofield",
        "title": "Bíblia Scofield",
        "items": [
          "Notas extensas em Daniel 7:13 sobre 'Filho do Homem' e sua conexão com Mt 26:64",
          "Nota dispensacionalista em Daniel 9:24 — Scofield é referência clássica para a interpretação das 70 semanas",
          "Nota em Daniel 11:36 — 'o rei que faz sua vontade' e a figura do Anticristo",
          "Apêndice 'Cronologia Profética' no final da Scofield — consultar a linha de Daniel"
        ]
      },
      {
        "type": "atlas",
        "title": "Atlas Reinke + Zondervan",
        "items": [
          "Reinke — Mapa do Império Babilônico e Persa (caps. relevantes para Daniel 7–8)",
          "Reinke — Rota do exílio: Jerusalém → Babilônia; localize Susa (Daniel 8:2)",
          "Zondervan p.182–190 — 'The World of Daniel': excelente reconstrução geográfica dos quatro impérios",
          "Zondervan — Mapa da campanha de Alexandre (Daniel 8: o bode dos gregos)"
        ]
      },
      {
        "type": "escatologia",
        "title": "Escatologia",
        "items": [
          "LaHaye (Enciclopédia Popular) — verbetes: 'Setenta Semanas', 'Anticristo', 'Tribulação', 'Filho do Homem'",
          "Charting the End Times — Diagrama das 70 Semanas de Daniel (p.30–35): use com a família, é visual",
          "Charting — Gráfico 'Four Kingdoms of Daniel' (p.28): mostre para a filha como os reinos se encaixam",
          "Pentecost (Manual de Escatologia) — Cap. sobre Daniel 9: leitura sua pessoal, não para discussão em família"
        ]
      },
      {
        "type": "personagens",
        "title": "Enciclopédia de Personagens · Matheus Soares",
        "items": [
          "Daniel — perfil completo; destaque o desenvolvimento do cap.1 ao cap.12",
          "Gabriel — aparece em Daniel 8:16 e 9:21; mesmo anjo de Lucas 1",
          "Nabucodonosor — já estudado em semanas anteriores; revisar conexão com Daniel 7",
          "Miguel — príncipe angelical em Daniel 10:13,21 e 12:1; conectar com Jd 9 e Ap 12:7"
        ]
      },
      {
        "type": "dicionario",
        "title": "Dicionário Bíblico Crescer",
        "items": [
          "Querubim / Serafim — contexto da visão do cap.10",
          "Babilônia — resumo histórico e simbólico",
          "Abominação da desolação — Daniel 9:27; 11:31; 12:11 — termo que Jesus retoma em Mt 24:15",
          "Susa — cidade persa; local da visão do capítulo 8"
        ]
      },
      {
        "type": "judaica",
        "title": "Bíblia Judaica Completa",
        "items": [
          "Daniel 7:13 — compare 'bar enash' (filho do homem em aramaico) na tradução de Stern com a LXX",
          "Daniel 9:24 — 'shavuim shivim' (setenta semanas/heptadas): Stern traz nota sobre a contagem judaica",
          "Verifique o nome hebraico/aramaico dos personagens: Daniel = Dan'iel, Miguel = Mikha'el, Gabriel = Gavri'el"
        ]
      },
      {
        "type": "extra",
        "title": "Sugestão Adicional",
        "items": [
          "Para a filha (9 anos): após o estudo, peça que ela desenhe uma das bestas de Daniel 7 como ela imaginou. Crie uma tradição de 'ilustração da semana' nas semanas com visões proféticas",
          "Conexão NT para mencionar em família: leia Mateus 24:15–22 logo após Daniel 9:27 — Jesus está citando exatamente o que vocês acabaram de ler",
          "Versículo para memorizar juntos: Daniel 12:3 — 'Os entendidos resplandecerão como o fulgor do firmamento'"
        ]
      }
    ]
  },
  "reflection": {
    "verse": "\"Os que têm entendimento resplandecerão como o fulgor do firmamento, e os que a muitos ensinam a justiça, como as estrelas, para sempre e eternamente.\"",
    "reference": "Daniel 12:3",
    "question": "Pergunta para discussão em família: Gabriel veio especialmente a Daniel quando ele ainda estava orando (Daniel 9:20–21). O que isso nos diz sobre a oração como ponto de partida para entender os planos de Deus?"
  }
}
